{
    "schema":  "igs-test-run/1",
    "run_id":  "20261016-0806",
    "started_at":  "2026-10-16 08:06 UTC+3",
    "finished_at":  "2026-10-16 08:06 UTC+3",
    "commit":  "d57072f",
    "branch":  "release-ready-2026-10-14",
    "dirty_count":  598,
    "machine":  "I1",
    "totals":  {
                   "pass":  21,
                   "fail":  0,
                   "skipped":  0,
                   "total":  21
               },
    "suites":  [
                   {
                       "id":  "i18n",
                       "name":  "i18n checks",
                       "command":  "identity+coverage+lint+langs_consistency+critic_check",
                       "exit_code":  0,
                       "ms":  4368,
                       "log":  "09-Docs/test-runs/logs/20261016-0806/i18n.log",
                       "totals":  {
                                      "pass":  21,
                                      "fail":  0,
                                      "skipped":  0,
                                      "total":  21
                                  },
                       "tests":  [
                                     {
                                         "id":  "i18n.identity.OK",
                                         "file":  "i18n_identity.mjs",
                                         "title":  "identity OK",
                                         "status":  "pass",
                                         "ms":  0
                                     },
                                     {
                                         "id":  "i18n.coverage.en",
                                         "file":  "i18n_coverage.mjs",
                                         "title":  "coverage en",
                                         "status":  "pass",
                                         "ms":  0
                                     },
                                     {
                                         "id":  "i18n.coverage.ru",
                                         "file":  "i18n_coverage.mjs",
                                         "title":  "coverage ru",
                                         "status":  "pass",
                                         "ms":  0
                                     },
                                     {
                                         "id":  "i18n.coverage.pt-BR",
                                         "file":  "i18n_coverage.mjs",
                                         "title":  "coverage pt-BR",
                                         "status":  "pass",
                                         "ms":  0
                                     },
                                     {
                                         "id":  "i18n.coverage.hi",
                                         "file":  "i18n_coverage.mjs",
                                         "title":  "coverage hi",
                                         "status":  "pass",
                                         "ms":  0
                                     },
                                     {
                                         "id":  "i18n.coverage.id",
                                         "file":  "i18n_coverage.mjs",
                                         "title":  "coverage id",
                                         "status":  "pass",
                                         "ms":  0
                                     },
                                     {
                                         "id":  "i18n.coverage.de",
                                         "file":  "i18n_coverage.mjs",
                                         "title":  "coverage de",
                                         "status":  "pass",
                                         "ms":  0
                                     },
                                     {
                                         "id":  "i18n.coverage.fr",
                                         "file":  "i18n_coverage.mjs",
                                         "title":  "coverage fr",
                                         "status":  "pass",
                                         "ms":  0
                                     },
                                     {
                                         "id":  "i18n.coverage.ja",
                                         "file":  "i18n_coverage.mjs",
                                         "title":  "coverage ja",
                                         "status":  "pass",
                                         "ms":  0
                                     },
                                     {
                                         "id":  "i18n.coverage.vi",
                                         "file":  "i18n_coverage.mjs",
                                         "title":  "coverage vi",
                                         "status":  "pass",
                                         "ms":  0
                                     },
                                     {
                                         "id":  "i18n.coverage.ko",
                                         "file":  "i18n_coverage.mjs",
                                         "title":  "coverage ko",
                                         "status":  "pass",
                                         "ms":  0
                                     },
                                     {
                                         "id":  "i18n.coverage.th",
                                         "file":  "i18n_coverage.mjs",
                                         "title":  "coverage th",
                                         "status":  "pass",
                                         "ms":  0
                                     },
                                     {
                                         "id":  "i18n.coverage.it",
                                         "file":  "i18n_coverage.mjs",
                                         "title":  "coverage it",
                                         "status":  "pass",
                                         "ms":  0
                                     },
                                     {
                                         "id":  "i18n.coverage.pl",
                                         "file":  "i18n_coverage.mjs",
                                         "title":  "coverage pl",
                                         "status":  "pass",
                                         "ms":  0
                                     },
                                     {
                                         "id":  "i18n.coverage.uk",
                                         "file":  "i18n_coverage.mjs",
                                         "title":  "coverage uk",
                                         "status":  "pass",
                                         "ms":  0
                                     },
                                     {
                                         "id":  "i18n.coverage.zh-TW",
                                         "file":  "i18n_coverage.mjs",
                                         "title":  "coverage zh-TW",
                                         "status":  "pass",
                                         "ms":  0
                                     },
                                     {
                                         "id":  "i18n.coverage.ms",
                                         "file":  "i18n_coverage.mjs",
                                         "title":  "coverage ms",
                                         "status":  "pass",
                                         "ms":  0
                                     },
                                     {
                                         "id":  "i18n.coverage.bn",
                                         "file":  "i18n_coverage.mjs",
                                         "title":  "coverage bn",
                                         "status":  "pass",
                                         "ms":  0
                                     },
                                     {
                                         "id":  "i18n.lint.open",
                                         "file":  "i18n_lint.mjs",
                                         "title":  "open findings = 0",
                                         "status":  "pass",
                                         "ms":  0
                                     },
                                     {
                                         "id":  "i18n.langs_consistency",
                                         "file":  "langs_consistency.test.js",
                                         "title":  "langs consistency (5 sets)",
                                         "status":  "pass",
                                         "ms":  0,
                                         "error_first_line":  "Duration  2.17s (transform 79ms, setup 23ms, collect 44ms, tests 41ms, environment 1.51s, prepare 248ms) |"
                                     },
                                     {
                                         "id":  "i18n.critic_check",
                                         "file":  "critic_check.mjs",
                                         "title":  "critic artifacts valid",
                                         "status":  "pass",
                                         "ms":  0,
                                         "error_first_line":  "OK files=0 models=0"
                                     }
                                 ]
                   }
               ]
}